{
  "schema_version": 1,
  "catalog_kind": "installed-workspace-description",
  "size_policy": "probed_bytes counts declared probe files only. It is not a download size, an install size, or a full directory footprint.",
  "components": [
    {
      "id": "app.core",
      "name": "Core Application",
      "kind": "application",
      "ownership": "managed",
      "required": true,
      "implemented": true,
      "version": "1.0.0-local.20261009",
      "version_evidence": "VERSION",
      "version_probe": {
        "type": "text_file",
        "file": "VERSION"
      },
      "capabilities": [
        "app.launch"
      ],
      "modes": [
        "polish",
        "voice_conversion",
        "transcribe"
      ],
      "dependencies": [],
      "probes": [
        {
          "type": "relative_file",
          "path": "AI_Music_Processor.pyw",
          "role": "required"
        },
        {
          "type": "relative_file",
          "path": "process_music.py",
          "role": "required"
        },
        {
          "type": "relative_file",
          "path": "core/pipeline.py",
          "role": "required"
        },
        {
          "type": "relative_file",
          "path": "VERSION",
          "role": "required"
        }
      ],
      "license_status": "UNKNOWN",
      "distribution_status": "UNKNOWN"
    },
    {
      "id": "runtime.python",
      "name": "Python AI Runtime",
      "kind": "runtime",
      "ownership": "managed",
      "required": true,
      "implemented": true,
      "version": "3.9.13",
      "version_evidence": "runtime-manifest/runtime.json python.version",
      "version_probe": {
        "type": "json_keys",
        "file": "runtime-manifest/runtime.json",
        "keys": [
          "python",
          "version"
        ]
      },
      "capabilities": [
        "runtime.python"
      ],
      "modes": [
        "polish",
        "voice_conversion",
        "transcribe"
      ],
      "dependencies": [],
      "probes": [
        {
          "type": "relative_file",
          "path": "tools/RVC/RVC-beta-v2-0618/runtime/python.exe",
          "role": "required"
        }
      ],
      "license_status": "UNKNOWN",
      "distribution_status": "UNKNOWN"
    },
    {
      "id": "runtime.torch",
      "name": "Torch Runtime",
      "kind": "runtime",
      "ownership": "managed",
      "required": true,
      "implemented": true,
      "version": "2.0.0+cu118",
      "version_evidence": "runtime-manifest/packages.lock.json name=torch",
      "version_probe": {
        "type": "path_exists",
        "path": "tools/RVC/RVC-beta-v2-0618/runtime/Lib/site-packages/torch-2.0.0+cu118.dist-info"
      },
      "capabilities": [
        "runtime.torch"
      ],
      "modes": [
        "voice_conversion",
        "transcribe"
      ],
      "dependencies": [
        "runtime.python"
      ],
      "probes": [
        {
          "type": "relative_dir",
          "path": "tools/RVC/RVC-beta-v2-0618/runtime/Lib/site-packages/torch-2.0.0+cu118.dist-info",
          "role": "required"
        }
      ],
      "license_status": "UNKNOWN",
      "distribution_status": "UNKNOWN"
    },
    {
      "id": "runtime.fairseq",
      "name": "fairseq",
      "kind": "runtime",
      "ownership": "managed",
      "required": true,
      "implemented": true,
      "version": "0.12.2",
      "version_evidence": "runtime-manifest/packages.lock.json name=fairseq",
      "version_probe": {
        "type": "path_exists",
        "path": "tools/RVC/RVC-beta-v2-0618/runtime/Lib/site-packages/fairseq-0.12.2.dist-info"
      },
      "capabilities": [
        "voice.feature_runtime"
      ],
      "modes": [
        "voice_conversion"
      ],
      "dependencies": [
        "runtime.python"
      ],
      "probes": [
        {
          "type": "relative_dir",
          "path": "tools/RVC/RVC-beta-v2-0618/runtime/Lib/site-packages/fairseq-0.12.2.dist-info",
          "role": "required"
        }
      ],
      "license_status": "UNKNOWN",
      "distribution_status": "UNKNOWN"
    },
    {
      "id": "runtime.faiss",
      "name": "faiss-cpu",
      "kind": "runtime",
      "ownership": "managed",
      "required": true,
      "implemented": true,
      "version": "1.7.2",
      "version_evidence": "runtime-manifest/packages.lock.json name=faiss-cpu",
      "version_probe": {
        "type": "path_exists",
        "path": "tools/RVC/RVC-beta-v2-0618/runtime/Lib/site-packages/faiss_cpu-1.7.2.dist-info"
      },
      "capabilities": [
        "voice.index_runtime"
      ],
      "modes": [
        "voice_conversion"
      ],
      "dependencies": [
        "runtime.python"
      ],
      "probes": [
        {
          "type": "relative_dir",
          "path": "tools/RVC/RVC-beta-v2-0618/runtime/Lib/site-packages/faiss_cpu-1.7.2.dist-info",
          "role": "required"
        }
      ],
      "details": {
        "notes": "vc_infer_pipeline.py imports faiss at module import, so the package is required even when index_rate is 0."
      },
      "license_status": "UNKNOWN",
      "distribution_status": "UNKNOWN"
    },
    {
      "id": "runtime.demucs",
      "name": "Demucs package",
      "kind": "runtime",
      "ownership": "managed",
      "required": true,
      "implemented": true,
      "version": "4.0.1",
      "version_evidence": "runtime-manifest/packages.lock.json name=demucs",
      "version_probe": {
        "type": "path_exists",
        "path": "runtime/addons/demucs-4.0.1.dist-info"
      },
      "capabilities": [
        "separator.four_stem.runtime"
      ],
      "modes": [
        "transcribe"
      ],
      "dependencies": [
        "runtime.python",
        "runtime.torch"
      ],
      "probes": [
        {
          "type": "relative_dir",
          "path": "runtime/addons/demucs-4.0.1.dist-info",
          "role": "required"
        }
      ],
      "license_status": "UNKNOWN",
      "distribution_status": "UNKNOWN"
    },
    {
      "id": "runtime.basic_pitch",
      "name": "basic-pitch package",
      "kind": "runtime",
      "ownership": "managed",
      "required": true,
      "implemented": true,
      "version": "0.4.0",
      "version_evidence": "runtime-manifest/packages.lock.json name=basic-pitch",
      "version_probe": {
        "type": "path_exists",
        "path": "runtime/addons/basic_pitch-0.4.0.dist-info"
      },
      "capabilities": [
        "midi.runtime"
      ],
      "modes": [
        "transcribe"
      ],
      "dependencies": [
        "runtime.python"
      ],
      "probes": [
        {
          "type": "relative_dir",
          "path": "runtime/addons/basic_pitch-0.4.0.dist-info",
          "role": "required"
        }
      ],
      "license_status": "UNKNOWN",
      "distribution_status": "UNKNOWN"
    },
    {
      "id": "tool.ffmpeg",
      "name": "FFmpeg",
      "kind": "tool",
      "ownership": "managed",
      "required": true,
      "implemented": true,
      "version": null,
      "capabilities": [
        "audio.decode",
        "audio.encode"
      ],
      "modes": [
        "polish",
        "voice_conversion",
        "transcribe"
      ],
      "dependencies": [],
      "probes": [
        {
          "type": "tool",
          "name": "ffmpeg",
          "release_path": "runtime/bin/ffmpeg.exe",
          "dev_paths": [
            "tools/ffmpeg/ffmpeg.exe",
            "tools/RVC/RVC-beta-v2-0618/ffmpeg.exe"
          ],
          "allow_host_in_dev": true,
          "host_before_dev_path_index": 1
        }
      ],
      "license_status": "UNKNOWN",
      "distribution_status": "UNKNOWN"
    },
    {
      "id": "tool.ffprobe",
      "name": "ffprobe",
      "kind": "tool",
      "ownership": "managed",
      "required": true,
      "implemented": true,
      "version": null,
      "capabilities": [
        "audio.probe"
      ],
      "modes": [
        "polish",
        "voice_conversion",
        "transcribe"
      ],
      "dependencies": [],
      "probes": [
        {
          "type": "tool",
          "name": "ffprobe",
          "release_path": "runtime/bin/ffprobe.exe",
          "dev_paths": [
            "tools/ffmpeg/ffprobe.exe",
            "tools/RVC/RVC-beta-v2-0618/ffprobe.exe"
          ],
          "allow_host_in_dev": true,
          "host_before_dev_path_index": 1
        }
      ],
      "license_status": "UNKNOWN",
      "distribution_status": "UNKNOWN"
    },
    {
      "id": "engine.rvc",
      "name": "RVC voice engine",
      "kind": "engine",
      "ownership": "managed",
      "required": true,
      "implemented": true,
      "version": "RVC-beta-v2-0618",
      "version_evidence": "tools/RVC/RVC-beta-v2-0618",
      "version_probe": {
        "type": "path_exists",
        "path": "tools/RVC/RVC-beta-v2-0618"
      },
      "capabilities": [
        "voice.rvc"
      ],
      "modes": [
        "voice_conversion"
      ],
      "dependencies": [
        "runtime.python",
        "runtime.torch",
        "runtime.fairseq",
        "runtime.faiss"
      ],
      "probes": [
        {
          "type": "relative_file",
          "path": "tools/RVC/RVC-beta-v2-0618/vc_infer_pipeline.py",
          "role": "required"
        },
        {
          "type": "relative_file",
          "path": "tools/RVC/RVC-beta-v2-0618/my_utils.py",
          "role": "required"
        },
        {
          "type": "relative_file",
          "path": "tools/RVC/RVC-beta-v2-0618/infer_pack/models.py",
          "role": "required"
        },
        {
          "type": "relative_dir",
          "path": "tools/RVC/RVC-beta-v2-0618",
          "role": "required"
        }
      ],
      "details": {
        "f0_methods": [
          "harvest",
          "pm",
          "crepe",
          "rmvpe"
        ],
        "f0_methods_not_implemented": [],
        "notes": "RVC worker supports official RMVPE through a first-party VC adapter without editing 0618 vendor source; FP32 and F0 track export are enforced."